{
  "schema_version": "0.1",
  "record_type": "BENCHMARK_SUITE",
  "suite_id": "fixture.scoring.suite",
  "name": "StarBench offline scoring fixture suite",
  "version": "1.0.0",
  "description": "Local suite combining exact-match and rule/numeric scoring fixtures.",
  "task_references": [
    { "benchmark_task_id": "fixture.scoring.rules", "version": "1.0.0", "order": 20 },
    { "benchmark_task_id": "fixture.scoring.exact", "version": "1.0.0", "order": 10 }
  ],
  "default_parameters": { "execution_mode": "offline_scoring_fixture" },
  "tags": ["offline", "fixture", "scoring"],
  "source_class": "TEST_FIXTURE",
  "provenance": { "origin": "LOCAL_AUTHORED", "source_ref": null },
  "metadata": { "synthetic": true, "real_benchmark": false },
  "created_at": "2099-07-01T00:00:00.000Z"
}
